{
  "dataset": "treasury_reconciliation",
  "analytics_as_of": "2026-03-20T20:14:44.603849Z",
  "as_of": "2026-03-20T20:14:44.603849Z",
  "version": 1,
  "summary": {
    "matched_count": 63,
    "needs_review_count": 2,
    "window_summary": {
      "7d": {
        "route_count": 1,
        "proposal_count": 1,
        "recipient_count": 1
      },
      "30d": {
        "route_count": 1,
        "proposal_count": 1,
        "recipient_count": 1
      },
      "90d": {
        "route_count": 1,
        "proposal_count": 1,
        "recipient_count": 1
      },
      "all": {
        "route_count": 65,
        "proposal_count": 55,
        "recipient_count": 47
      }
    }
  },
  "records": [
    {
      "route_id": "gnars-base-117:1",
      "archive_id": "gnars-base-117",
      "proposal_number": 117,
      "proposal_title": "Sponsor Gnars Monik Santos in QS/WSL 2026",
      "chain": "base",
      "recipient_address": "0x25810d1a8b1affc444d5333bf0496f1202d6f89f",
      "recipient_display_name": "0x2581...f89f",
      "asset_symbol": "USDC",
      "amount": 1570.0,
      "token_contract": "0x833589fcd6edb6e08f4c7c32d4f71b54bda02913",
      "asset_contract_status": "external-token",
      "repo_value": {
        "amount": 1570.0,
        "asset_symbol": "USDC",
        "recipient_address": "0x25810d1a8b1affc444d5333bf0496f1202d6f89f",
        "proposal_status": "executed"
      },
      "site_value": {
        "proposal_status": "executed",
        "source_url": "https://www.gnars.com/proposals/base/117",
        "canonical_url": "https://www.gnars.com/proposals/base/117"
      },
      "chain_value": {
        "treasury_contract_id": "gnars-base-treasury",
        "treasury_contract_label": "Gnars Treasury",
        "treasury_explorer_url": "https://basescan.org/address/0x72ad986ebac0246d2b3c565ab2a1ce3a14ce6f88",
        "token_contract_id": null,
        "token_explorer_url": null
      },
      "resolved_value": {
        "amount_label": "1,570 USDC",
        "recipient_label": "0x2581...f89f",
        "treasury_source_label": "Gnars Treasury"
      },
      "reconciliation_status": "matched",
      "mismatch_fields": [],
      "evidence_urls": [
        "https://www.gnars.com/proposals/base/117",
        "https://basescan.org/address/0x72ad986ebac0246d2b3c565ab2a1ce3a14ce6f88"
      ]
    },
    {
      "route_id": "gnars-base-108:1",
      "archive_id": "gnars-base-108",
      "proposal_number": 108,
      "proposal_title": "SKATE ACROSS AFRICA (EAST COAST - SOUTH COAST)",
      "chain": "base",
      "recipient_address": "0x8d2a253a5885806aa14e583c80c8833a904fb252",
      "recipient_display_name": "0x8d2a...b252",
      "asset_symbol": "USDC",
      "amount": 2500.0,
      "token_contract": "0x833589fcd6edb6e08f4c7c32d4f71b54bda02913",
      "asset_contract_status": "external-token",
      "repo_value": {
        "amount": 2500.0,
        "asset_symbol": "USDC",
        "recipient_address": "0x8d2a253a5885806aa14e583c80c8833a904fb252",
        "proposal_status": "executed"
      },
      "site_value": {
        "proposal_status": "executed",
        "source_url": "https://www.gnars.com/proposals/base/108",
        "canonical_url": "https://www.gnars.com/proposals/base/108"
      },
      "chain_value": {
        "treasury_contract_id": "gnars-base-treasury",
        "treasury_contract_label": "Gnars Treasury",
        "treasury_explorer_url": "https://basescan.org/address/0x72ad986ebac0246d2b3c565ab2a1ce3a14ce6f88",
        "token_contract_id": null,
        "token_explorer_url": null
      },
      "resolved_value": {
        "amount_label": "2,500 USDC",
        "recipient_label": "0x8d2a...b252",
        "treasury_source_label": "Gnars Treasury"
      },
      "reconciliation_status": "matched",
      "mismatch_fields": [],
      "evidence_urls": [
        "https://www.gnars.com/proposals/base/108",
        "https://basescan.org/address/0x72ad986ebac0246d2b3c565ab2a1ce3a14ce6f88"
      ]
    },
    {
      "route_id": "gnars-base-104:1",
      "archive_id": "gnars-base-104",
      "proposal_number": 104,
      "proposal_title": "7Capasmag Skate&Jazz Vol 2 - New Nounstacle inauguration in Devconnect ",
      "chain": "base",
      "recipient_address": "0x9ad8d2a8ef4bf60a667dd43fcb178bdbd93ae1c8",
      "recipient_display_name": "7capas.eth",
      "asset_symbol": "ETH",
      "amount": 0.42,
      "token_contract": null,
      "asset_contract_status": "native",
      "repo_value": {
        "amount": 0.42,
        "asset_symbol": "ETH",
        "recipient_address": "0x9ad8d2a8ef4bf60a667dd43fcb178bdbd93ae1c8",
        "proposal_status": "executed"
      },
      "site_value": {
        "proposal_status": "executed",
        "source_url": "https://www.gnars.com/proposals/base/104",
        "canonical_url": "https://www.gnars.com/proposals/base/104"
      },
      "chain_value": {
        "treasury_contract_id": "gnars-base-treasury",
        "treasury_contract_label": "Gnars Treasury",
        "treasury_explorer_url": "https://basescan.org/address/0x72ad986ebac0246d2b3c565ab2a1ce3a14ce6f88",
        "token_contract_id": null,
        "token_explorer_url": null
      },
      "resolved_value": {
        "amount_label": "0.42 ETH",
        "recipient_label": "7capas.eth",
        "treasury_source_label": "Gnars Treasury"
      },
      "reconciliation_status": "matched",
      "mismatch_fields": [],
      "evidence_urls": [
        "https://www.gnars.com/proposals/base/104",
        "https://basescan.org/address/0x72ad986ebac0246d2b3c565ab2a1ce3a14ce6f88"
      ]
    },
    {
      "route_id": "gnars-base-101:2",
      "archive_id": "gnars-base-101",
      "proposal_number": 101,
      "proposal_title": "Gnars India Initiative: Building Bridges Through Skateboarding",
      "chain": "base",
      "recipient_address": "0x49d31dcb59e115f5c9e505a58a323ade076f2176",
      "recipient_display_name": "fernandoferreira.eth",
      "asset_symbol": "USDC",
      "amount": 2600.0,
      "token_contract": "0x833589fcd6edb6e08f4c7c32d4f71b54bda02913",
      "asset_contract_status": "external-token",
      "repo_value": {
        "amount": 2600.0,
        "asset_symbol": "USDC",
        "recipient_address": "0x49d31dcb59e115f5c9e505a58a323ade076f2176",
        "proposal_status": "executed"
      },
      "site_value": {
        "proposal_status": "executed",
        "source_url": "https://www.gnars.com/proposals/base/101",
        "canonical_url": "https://www.gnars.com/proposals/base/101"
      },
      "chain_value": {
        "treasury_contract_id": "gnars-base-treasury",
        "treasury_contract_label": "Gnars Treasury",
        "treasury_explorer_url": "https://basescan.org/address/0x72ad986ebac0246d2b3c565ab2a1ce3a14ce6f88",
        "token_contract_id": null,
        "token_explorer_url": null
      },
      "resolved_value": {
        "amount_label": "2,600 USDC",
        "recipient_label": "fernandoferreira.eth",
        "treasury_source_label": "Gnars Treasury"
      },
      "reconciliation_status": "matched",
      "mismatch_fields": [],
      "evidence_urls": [
        "https://www.gnars.com/proposals/base/101",
        "https://basescan.org/address/0x72ad986ebac0246d2b3c565ab2a1ce3a14ce6f88"
      ]
    },
    {
      "route_id": "gnars-base-101:1",
      "archive_id": "gnars-base-101",
      "proposal_number": 101,
      "proposal_title": "Gnars India Initiative: Building Bridges Through Skateboarding",
      "chain": "base",
      "recipient_address": "0x49d31dcb59e115f5c9e505a58a323ade076f2176",
      "recipient_display_name": "fernandoferreira.eth",
      "asset_symbol": "ETH",
      "amount": 0.619,
      "token_contract": null,
      "asset_contract_status": "native",
      "repo_value": {
        "amount": 0.619,
        "asset_symbol": "ETH",
        "recipient_address": "0x49d31dcb59e115f5c9e505a58a323ade076f2176",
        "proposal_status": "executed"
      },
      "site_value": {
        "proposal_status": "executed",
        "source_url": "https://www.gnars.com/proposals/base/101",
        "canonical_url": "https://www.gnars.com/proposals/base/101"
      },
      "chain_value": {
        "treasury_contract_id": "gnars-base-treasury",
        "treasury_contract_label": "Gnars Treasury",
        "treasury_explorer_url": "https://basescan.org/address/0x72ad986ebac0246d2b3c565ab2a1ce3a14ce6f88",
        "token_contract_id": null,
        "token_explorer_url": null
      },
      "resolved_value": {
        "amount_label": "0.619 ETH",
        "recipient_label": "fernandoferreira.eth",
        "treasury_source_label": "Gnars Treasury"
      },
      "reconciliation_status": "matched",
      "mismatch_fields": [],
      "evidence_urls": [
        "https://www.gnars.com/proposals/base/101",
        "https://basescan.org/address/0x72ad986ebac0246d2b3c565ab2a1ce3a14ce6f88"
      ]
    },
    {
      "route_id": "gnars-base-99:1",
      "archive_id": "gnars-base-99",
      "proposal_number": 99,
      "proposal_title": "Gnars Crew at Devconnect Buenos Aires 2025 – Skate + Hacker House",
      "chain": "base",
      "recipient_address": "0x39a7b6fa1597bb6657fe84e64e3b836c37d6f75d",
      "recipient_display_name": "r4topunk",
      "asset_symbol": "ETH",
      "amount": 1.0,
      "token_contract": null,
      "asset_contract_status": "native",
      "repo_value": {
        "amount": 1.0,
        "asset_symbol": "ETH",
        "recipient_address": "0x39a7b6fa1597bb6657fe84e64e3b836c37d6f75d",
        "proposal_status": "executed"
      },
      "site_value": {
        "proposal_status": "executed",
        "source_url": "https://www.gnars.com/proposals/base/99",
        "canonical_url": "https://www.gnars.com/proposals/base/99"
      },
      "chain_value": {
        "treasury_contract_id": "gnars-base-treasury",
        "treasury_contract_label": "Gnars Treasury",
        "treasury_explorer_url": "https://basescan.org/address/0x72ad986ebac0246d2b3c565ab2a1ce3a14ce6f88",